{
  "$schema": "http://json-schema.org/draft-07/schema#",
  "$id": "./sok-fagsaker-schema.json",
  "type": "array",
  "title": "The Root Schema",
  "uniqueItems": true,
  "items": {
    "$id": "#/items",
    "type": "object",
    "title": "The Items Schema",
    "additionalProperties": false,
    "required": [
      "saksnummer",
      "sammensattNavn",
      "saksstatus",
      "sakstype",
      "opprettetDato",
      "behandlingOversikter"
    ],
    "properties": {
      "saksnummer": {
        "$id": "#/items/properties/saksnummer",
        "type": "string",
        "title": "The Saksnummer Schema",
        "default": "",
        "examples": [
          "4"
        ],
        "pattern": "^(.*)$"
      },
      "sammensattNavn": {
        "$id": "#/items/properties/sammensattNavn",
        "type": "string",
        "title": "The sammensattNavn Schema",
        "default": "",
        "examples": [
          "FÃ¸rstNavn EtterNavn"
        ]
      },
      "saksstatus": {
        "$id": "#/items/properties/saksstatus",
        "title": "The Saksstatus Schema",
        "$ref": "./definitions-schema.json#/definitions/kodeverk"
      },
      "sakstype": {
        "$id": "#/items/properties/sakstype",
        "title": "The Sakstype Schema",
        "$ref": "./definitions-schema.json#/definitions/kodeverk"
      },
      "opprettetDato": {
        "title": "The Opprettetdato Schema",
        "$id": "#/items/properties/opprettetDato",
        "$ref": "./definitions-schema.json#/definitions/dato-tid"
      },
      "behandlingOversikter": {
        "title": "The behandlingOversikter Schema",
        "$id": "#/items/properties/behandlingOversikter",
        "$ref": "./behandlingOversikter-definitions.json#/definitions/behandlingOversikter"
      }
    }
  }
}



