[
  {
    "saksnummer": "5",
    "sammensattNavn" : "KAKE ARTIG",
    "opprettetDato": "2017-11-01T12:31:36.123Z",
    "sakstype": {
      "kode": "EU_EOS",
      "term": "EU/EØS"
    },
    "saksstatus" : {
      "kode" : "OPPRETTET",
      "term" : "Saken er opprettet"
    },
    "behandlingOversikter": [
      {
        "behandlingID": 5,
        "opprettetDato": "2017-10-01T12:31:36.123Z",
        "behandlingstype": {
          "kode": "SOEKNAD",
          "term": "Søknad"
        },
        "behandlingsstatus": {
          "kode": "OPPRETTET",
          "term": "Opprettet"
        },
        "soknadsperiode": {
          "fom": "2018-08-01",
          "tom": "2018-12-31"
        },
        "land": [
          "GB"
        ]
      },
      {
        "behandlingID": 9,
        "behandlingsstatus": {
          "kode": "AVSLUTTET",
          "term": "Behandlingen er avsluttet"
        },
        "behandlingstype": {
          "kode": "SOEKNAD",
          "term": "Søknad"
        },
        "land": [
          "NL"
        ],
        "opprettetDato": "2019-04-24T06:29:04.559Z",
        "soknadsperiode": {
          "fom": "2019-04-04",
          "tom": "2020-04-04"
        }
      }
    ]
  }
]
